UUID,Headline,Link,Content,Category,DateTime,Positive,Negative
c1f709c3-03f3-4303-a2d6-57d05b045ae1,"Don teaser: Diljit Dosanjh collabs with OG don SRK for upcoming music videoDiljit Dosanjh has released a teaser for his music video Don, featuring a special voiceover by Shah Rukh Khan. The teaser has captured fans' attention with SRK's powerful narration.",https://www.indiatoday.in/movies/bollywood/story/og-don-shah-rukh-khan-diljit-dosanjh-don-teaser-music-video-2648785-2024-12-12,"Singer-actor Diljit Dosanjh has unveiled the teaser for his upcoming music video Don, leaving fans excited with a special appearance by the voice of Bollywood superstar Shah Rukh Khan. The teaser, released on Thursday, showcases SRK delivering a powerful voiceover that has garnered widespread attention. The teaser was shared with the caption, ""Agar Sab Se Uper Tikna Hai Toh Maa Ki Duaa Chahiye ONE & ONLY KING @iamsrk (sic).""



 

 
 


 


View this post on Instagram

 


 
 
 


 
 


 
 
 



 
 

A post shared by DILJIT DOSANJH (@diljitdosanjh)


 A post shared by DILJIT DOSANJH (@diljitdosanjh)
 In the voiceover, Shah Rukh Khan says in Hindi, ""Puraani kahawat hai, ke sabse upar jaana hai to bohot saari mehnat chahiye. Lekin agar sabse upar tikna hai, to maa ki dua chahiye. Tumhara mujh tak pohochna mushkil hi nahi, namumkin hai. Kyunki dhool kitni bhi oonchi chali jaaye, kabhi aasman ko ganda nahi kar sakti. (There is an old saying that to rise to the top, immense hard work is required. But to stay at the top, you need a mother’s blessings. Reaching me is not just difficult; it is impossible. No matter how high the dust rises, it can never tarnish the sky.)"" The collaboration marks a unique blend of music and cinematic flair, with Dosanjh bringing his distinct musical style and Khan lending his iconic voice. Fans have expressed excitement on social media. One fan has written, ""King of Bollywood x king of punjabi industry (sic).""  Diljit Dosanjh recently took the stage in Bengaluru. To everyone’s surprise, the concert was graced by actor Deepika Padukone. Not only did she share the stage with Diljit, dancing to his tunes, but she also taught him a few Kannada phrases. Published By: Trisha BhattacharyaPublished On: Dec 12, 2024READ MORE |  No songs on alcohol, drugs: Chandigarh child panel to Diljit Dosanjh before show
",bollywood,2024-12-12T14:25:00,11.3,3.9
c351191e-93d8-4283-a980-063a81e0e623,"Varun Dhawan's Baby John: What to expect from the remake of Atlee's TheriBollywood star Varun Dhawan takes on a thrilling new role in Baby John, a remake of the Tamil hit, Theri. Directed by Kalees and produced by Atlee, the film promises action, drama, and emotional depth.",https://www.indiatoday.in/movies/bollywood/story/varun-dhawans-baby-john-what-to-expect-from-the-remake-of-atlees-theri-thalapathy-vijay-2647757-2024-12-11,"Bollywood star Varun Dhawan is gearing up to take audiences on a high-octane ride with his upcoming film, Baby John. Directed by Kalees and bankrolled by Atlee, this film is a remake of Atlee’s 2016 Tamil hit Theri, which starred Thalapathy Vijay, Samantha, and Amy Jackson.  If the trailer is anything to go by, Baby John appears to stick closely to the original story, promising a mix of emotional depth, thrilling action, and larger-than-life moments. Here’s what makes this project an exciting addition to the year’s lineup.  advertisementA Cop-Turned-Family Man First things first, let’s address the elephant in the room -- Varun Dhawan won’t be playing a double role in Baby John. Much like Thalapathy Vijay in Theri, Varun’s character is a decorated police officer who is forced to leave the force under mysterious circumstances (no spoilers, of course!) and move to a quiet life with his young daughter.   First things first, let’s address the elephant in the room -- Varun Dhawan won’t be playing a double role in Baby John. Much like Thalapathy Vijay in Theri, Varun’s character is a decorated police officer who is forced to leave the force under mysterious circumstances (no spoilers, of course!) and move to a quiet life with his young daughter.   But wouldn’t it be a twist if there was a secret double role lurking somewhere? While the trailer doesn’t suggest this, it’s still fun to imagine the dramatic possibilities.  Even without a second character, Varun has a meaty role to sink his teeth into. The father-daughter relationship and its emotional resonance are sure to tug at your heartstrings, just as they did in Theri.   While Baby John sticks closely to its source material, the fact that it’s a remake doesn’t mean it lacks originality.   Varun Dhawan: Stepping into the Mass Hero Arena  What truly has fans buzzing is the chance to see Varun Dhawan embrace a massy, larger-than-life action hero persona. Sure, we saw shades of an intense Varun in Badlapur, but Baby John could take this to a whole new level. Following in the footsteps of Atlee’s Jawan, which turned Shah Rukh Khan into a never-seen-before action hero, this film has the potential to elevate Varun’s stardom.   The trailer already teases some explosive action sequences, and Varun looks every bit the part. His work in Citadel: Honey Bunny has proven that he can handle intense choreography; so expect punches, kicks, and slow-motion shots galore. For fans of South Indian cinema and Thalapathy Vijay’s Theri, this will be a litmus test for how Varun stacks up to the original star.Look Out for Top-Notch Craftsmanship Another highlight of Baby John is its technical brilliance. The cinematography by Kiran Koushik promises to make the action sequences pop and the emotional moments shine. The trailer hints at a visual treat, with rich colours and dramatic lighting accentuating every frame. Expect the camera work to take you straight into the heart of the chaos while also giving weight to the film’s more tender scenes.   And let’s not forget the editing. Reuben, who worked on the blockbuster Jawan, is in charge of piecing this film together. His knack for creating tight, edge-of-your-seat sequences will be crucial in making Baby John a gripping experience. If Jawan is anything to go by, Reuben knows how to keep audiences glued to their seats.    Cameos and Soundtracks to Look Forward To  Adding even more excitement is Salman Khan’s cameo as DIG Varadha Rajan. His brief but impactful appearance in the trailer has already sent fans into a frenzy.  This marks the first step in Salman’s collaboration with Atlee, and it’s thrilling to see the groundwork being laid for bigger things to come. Who wouldn’t want to see Salman and Varun sharing the screen in a high-stakes action sequence?   Apart from Salman Khan, Sanya Malhotra will also be seen in a cameo appearance.  Music is another element that’s bound to elevate the film. Thaman S, known for his dynamic compositions, is behind the score, and it already sounds like a winner.   The trailer features a track with a rap by Raja Kumari, blending Thaman’s signature beats with contemporary energy. The result? A soundtrack that’s sure to stick in your head long after the credits roll.   Varun Dhawan’s distinct style and Bollywood’s flair for grandeur will undoubtedly give the film its own identity. For audiences who loved Theri, Baby John offers a chance to revisit a beloved story with fresh faces and a slightly different lens.  For those new to the tale, it’s an opportunity to experience a gripping narrative that blends action, drama, and heartfelt moments.   In a time when Bollywood is embracing mass filmmaking in a big way, Baby John could be a major turning point for Varun Dhawan. Whether it’s his transformation into an action hero, the film’s high production values, or the buzzworthy cameos and music, there’s plenty to look forward to.  So, mark your calendars and get ready — Baby John arrives on December 25, 2024.Published By: Trisha BhattacharyaPublished On: Dec 11, 2024READ MORE |  Varun Dhawan's Baby John taster cut sends fans into frenzy: The hype is real
",bollywood,2024-12-11T11:31:00,17.0,3.1
0e006bea-61bf-45f3-9ffc-2b75d976e3cb,"Singham Again OTT release: When and where to watch Ajay Devgn's actionerSingham Again, starring Ajay Devgn, is now available on Prime Video. The film, which was released on Diwali, earned around Rs 300 crore in India. ",https://www.indiatoday.in/movies/bollywood/story/singham-again-on-ott-when-and-where-to-watch-rohit-shetty-ajay-devgns-actioner-2652743-2024-12-20,"Singham Again, starring Ajay Devgn, Kareena Kapoor, Arjun Kapoor, and Tiger Shroff, is now available on OTT. The high-octane action and compelling narrative have captivated audiences nationwide. Singham Again, released in theatres on Diwali, is available on Prime Video for rent. Ajay Devgn reprises his iconic role as Bajirao Singham, while Ranveer Singh adds his signature energy and comedic flair. Arjun Kapoor's portrayal of the villain has been praised for its depth. The film has collected Rs 297 crore in India, according to Sacnilk.com. Watch the trailer of Singham Again here:    India Today Digital's review of Singham Again reads, ""What we do need to mention is how beautifully Rohit Shetty incorporated a mythological story into a contemporary setting. Other filmmakers (if you know, you know) could take a leaf from his vision of how you can tell these stories with a modern twist without making them ghastly. Be it the background score for each character or the references to the epic tale, it fascinates and entertains at the same time."" Singham Again also features Akshay Kumar, Kareena Kapoor Khan, Ranveer Singh, Deepika Padukone, Shweta Tiwari and Dayanand Shetty, among others. It is the third in the Singham franchise and fifth in Shetty's cop-verse. Published By: Anisha RaoPublished On: Dec 20, 2024ALSO READ |  Diljit Dosanjh in Chamkila, Arjun Kapoor in Singham Again: Top performances of 2024Must Watch 
",bollywood,2024-12-20T12:11:00,9.4,1.3
6968f830-dcd4-46c5-a90b-8c2c065ceee6,"Thalapathy Vijay loved Varun Dhawan's work in Baby John: Director KaleesIn an interview, director Kalees revealed that Thalapathy Vijay was impressed by Baby John and highly appreciated Varun Dhawan's performance. Baby John is an adaptation of the 2016 Tamil film in which Vijay played the lead role.






",https://www.indiatoday.in/movies/bollywood/story/thalapathy-vijay-impressed-baby-john-varun-dhawan-work-director-kalees-2652819-2024-12-20,"Actor Thalapathy Vijay was impressed by the trailer of Baby John. According to director Kalees, Vijay praised the film's unique presentation. The Varun Dhawan-starrer Baby John is an adaptation of Atlee's 2016 Tamil film Theri, which originally featured Thalapathy Vijay in the lead role. Kalees revealed that Vijay was deeply impressed by Varun’s performance and the energy he brought to the film. While talking to India Today Digital, Kalees said, ""Atlee introduced me to Vijay sir because he has worked with him, and I was kind of new to him. He was warm during the meeting. Later, we showed him the trailer, and he was very impressed. He had such kind words to say about it—it really made my day. Vijay sir also appreciated Varun's work and the way we have presented him."" ""We could have easily shown Varun in Manali or any other state, but those locations have already been overexposed to audiences. We wanted to bring a new element, so Varun's character is set in Kerala. We have explored Kerala like never before in Baby John,” he added. Having said that, Kalees was asked if he is planning to bring the Tamil actor for a cameo in Baby John, the director responded, ""Aha! No, here we have Salman Khan's larger-than-life cameo, which will surely make the audience happy. Having said that, we would have loved to get him too, but he was already busy with his political career at the time."" Earlier, Shah Rukh Khan had praised the film’s trailer and lauded the efforts of the entire team. He highlighted the performances of the star-studded cast, including Varun Dhawan, Jackie Shroff, Keerthy Suresh, and Wamiqa Gabbi. “What an exciting trailer. Well done, really looking forward to seeing the film....@kalees_dir your #BabyJohn is everything like u. Energetic and full of action. @Atlee_dir go forth and conquer now as a producer. Love u. @Varun_dvn I am so happy to see u like this, all tough. @bindasbhidu deadly u look Jaggu da... @keerthyofficial #WamiqaGabbi all the best....A complete package, wishing goodness to the whole team (sic),” he wrote on X. Set for release on December 25, the film stars Keerthy Suresh, Wamiqa Gabbi, and Jackie Shroff in key roles. Baby John is produced by Atlee and his wife, Priya Atlee.Published By: Prachi aryaPublished On: Dec 20, 2024ALSO READ  |  Director Atlee on Baby John vs Pushpa 2 in theatres: Don't call it a clashTrending Reel 
",bollywood,2024-12-20T13:30:00,16.3,0.9
47cbd85a-5124-418f-94a8-9c5c096ba740,"Vanvaas review: Nana Patekar, Utkarsh Sharma's film is a dull version of BaghbanReleased-Fri Dec 20, 2024Vanvaas, starring Nana Patekar and Utkarsh Sharma, explores the deteriorating bond between parents and children, reminiscent of Baghban but with a deeper twist. Despite its noble intentions, the film struggles with execution and fails to evoke the emotional depth it aims for.",https://www.indiatoday.in/movies/reviews/story/vanvaas-movie-review-nana-patekar-utkarsh-sharma-film-dull-version-baghban-2652809-2024-12-20,"Release Date: 20 Dec, 2024 The relationship between parents and their children is believed to be sacred, but is it really so? Are children financially and emotionally capable of caring for their elderly parents? Over time, the philosophy that ‘blood is thicker than water’ seems to lose its essence. Attempting to reiterate this belief, Anil Sharma, after the mega-successful Gadar 2, made Vanvaas. The film addresses how children, sometimes, go to extremes to rid themselves of old parents and how, at times, their love is merely about securing financial gains after their death. Starring Nana Patekar and Utkarsh Sharma in lead roles, Vanvaas may have noble intentions but falters at the execution level, making it a tedious watch. The film bears an uncanny resemblance to Amitabh Bachchan's 2003 film Baghban, but the children in Vanvaas are far more malicious. From neglecting their parents to feeling emotionally detached as they grow older, the narrative captures the growing disconnection between generations. In Vanvaas, the father (Nana Patekar), still grieving his wife’s death, is diagnosed with dementia. This further deteriorates his relationship with his family. When he decides to donate his house to a trust, his children conspire to abandon him in Varanasi, far from their Palampur home, and even pronounce him dead to inherit his assets. Meanwhile, a stranger and a crook, Veeru (Utkarsh Sharma), in the ghats, bumps into him, decides to care for him and works to reunite him with his family.

The theme of an outsider caring for an abandoned elder while their children desert them is reminiscent of Baghban. However, in Baghban, the emotional connections between the characters were heartfelt and convincing. In contrast, Vanvaas fails to develop a meaningful bond between Deepak (Nana Patekar) and Veeru. The writing and direction do not allow their relationship to grow naturally, and moments that should feel poignant instead come across as superficial. For instance, a conversation over local liquor lacks any depth or emotion. Similarly, the sons’ animosity toward their father is portrayed without context, making their motivations appear one-dimensional. Providing more insight into their hatred could have added layers to the story.

Although Vanvaas aspires to be a deeply emotional film, the dialogues lack impact. They fail to evoke tears or heartache and occasionally veer into unintentional humour. The love story between Utkarsh and Simrat Kaur is underdeveloped and adds little to the narrative. The music is forgettable, with none of the songs leaving a lasting impression. The film’s long runtime of 2 hours and 40 minutes tests the audience’s patience as the story unfolds at a sluggish pace. Watch the trailer of Vanvaas here:    Surprisingly, this film comes from Anil Sharma, who previously delivered memorable entertainment with films like Gadar. Even his previous film, Apne, gave families the iconic line ‘Apne toh apne hote hai’, but there is nothing similarly impactful to take away from Vanvaas.

The film’s saving grace is Rajpal Yadav, who lights up the screen with his impeccable comic timing and witty dialogues, offering a much-needed relief. Utkarsh Sharma has grown as an actor since Gadar 2 and delivers a commendable performance. However, Nana Patekar’s portrayal is underwhelming, as he appears to simply recite his lines without much emotional investment. Ashwini Kalsekar’s over-the-top acting detracts from the film, while the rest of the cast remains largely forgettable. Moreover, the outdated cinematography and performances make the film feel stuck in the 1980s.

Vanvaas is well-intentioned, but it will surely have a tough time, fighting mass entertainers Pushpa 2 and Baby John in theatres.Published By: Anindita MukhopadhyayPublished On: Dec 20, 2024ALSO READ |  Nana Patekar invites Aamir Khan for a special screening of his film Vanvaas
",bollywood,2024-12-20T13:37:00,12.5,11.1
724c9c7b-fcc8-4b9f-ab51-6245a5b5fd35,"Barack Obama's 2024 film recommendations: All We Imagine As Light tops the listBarack Obama has listed Payal Kapadia's film, All We Imagine As Light, as his top movie recommendation for 2024, highlighting its international acclaim. The list also features films like Dune: Part Two, Conclave, and more.",https://www.indiatoday.in/movies/bollywood/story/barack-obama-2024-movie-recommendations-payal-kapadia-all-we-imagine-as-light-tops-list-2653227-2024-12-21,"Payal Kapadia's Golden Globe-nominated film, All We Imagine As Light, has been listed by former US President Barack Obama as one of his top movie recommendations for 2024. Other films on the list include Timothee Chalamet-Zendaya's Dune: Part Two, Ralph Fiennes's Conclave, and others. All We Imagine As Light remained in the headlines all through 2024 for earning several awards and nominations at international levels. The film topped Obama's 2024 movie list. The other films that made it to his yearly list include Conclave, The Piano Lesson, The Promised Land, The Seed of the Sacred Fig, Dune: Part Two, Anora, Didi, Sugarcane, A Complete Unknown. ""Here are a few movies I’d recommend checking out this year (sic),"" he wrote while sharing the list.

Here are a few movies I’d recommend checking out this year. pic.twitter.com/UtdKmsNUE8
— Barack Obama (@BarackObama) December 20, 2024
 Here are a few movies I’d recommend checking out this year. pic.twitter.com/UtdKmsNUE8
— Barack Obama (@BarackObama) December 20, 2024 Apart from films, Obama listed his favourite music of 2024. It included songs like Squabble Up by Kendrick Lamar, Yayo by Rema, and others. ""Here are my favorite songs from this year! Check them out if you’re looking to shake up your playlist – and let me know if there’s a song or artist I should make sure to listen to (sic),"" Obama wrote.

Here are my favorite songs from this year! Check them out if you’re looking to shake up your playlist – and let me know if there’s a song or artist I should make sure to listen to. pic.twitter.com/MK51Z77uEb
— Barack Obama (@BarackObama) December 21, 2024
And these were his book recommendations of the year:

I always look forward to sharing my annual list of favorite books, movies, and music. Today I’ll start by sharing some of the books that have stuck with me long after I finished reading them.

Check them out this holiday season, preferably at an independent bookstore or library! pic.twitter.com/NNcAnaFzdU
— Barack Obama (@BarackObama) December 20, 2024
Previously, Barack Obama listed Cold Mess by Prateek Kuhad as one of his top music recommendations for 2019.  Here are my favorite songs from this year! Check them out if you’re looking to shake up your playlist – and let me know if there’s a song or artist I should make sure to listen to. pic.twitter.com/MK51Z77uEb
— Barack Obama (@BarackObama) December 21, 2024 And these were his book recommendations of the year:

I always look forward to sharing my annual list of favorite books, movies, and music. Today I’ll start by sharing some of the books that have stuck with me long after I finished reading them.

Check them out this holiday season, preferably at an independent bookstore or library! pic.twitter.com/NNcAnaFzdU
— Barack Obama (@BarackObama) December 20, 2024
 I always look forward to sharing my annual list of favorite books, movies, and music. Today I’ll start by sharing some of the books that have stuck with me long after I finished reading them.

Check them out this holiday season, preferably at an independent bookstore or library! pic.twitter.com/NNcAnaFzdU
— Barack Obama (@BarackObama) December 20, 2024 Previously, Barack Obama listed Cold Mess by Prateek Kuhad as one of his top music recommendations for 2019.  All We Imagine As Light, directed by Payal Kapadia, stars Kani Kasruti, Divya Prabha, Chhaya Kadam and Hridhu Haroon in key roles. It became the first Indian film to win the prestigious Grand Prix at Cannes 2024. It has also received the Jury Grand Prize at the Asia Pacific Screen Awards, Best International Feature at Gotham Awards, and Best International Film Award at the New York Film Critics Circle. The film is now vying for a Critics' Choice Awards nomination for Best Foreign Language Film. It has also earned two nods at Golden Globes 2025 in the Best Non-English Language Motion Picture and Best Director (Motion Picture) categories.Published By: Anindita MukhopadhyayPublished On: Dec 21, 2024ALSO READ |  Payal Kapadia reacts to jurors claiming All We Imagine... 'wasn't Indian enough'Must Watch 
",bollywood,2024-12-21T09:05:00,16.0,3.6
ccb1661a-2722-48bd-a329-e29338e12c9a,"Ali Fazal, Richa Chadha broke fixed deposits to fund Girls Will Be GirlsActors Richa Chadha and Ali Fazal broke their fixed deposits to fund their debut production Girls Will Be Girls, which has been praised for its portrayal of adolescent challenges. The film premiered at international festivals and is now available on Prime Video.",https://www.indiatoday.in/movies/bollywood/story/ali-fazal-richa-chadha-broke-fixed-deposits-to-fund-girls-will-be-girls-2653459-2024-12-21,"Actors Richa Chadha and Ali Fazal, who produced the critically acclaimed film Girls Will Be Girls, said that they broke their fixed deposits for the film. The film starring Kani Kusruti and Preeti Panigrahi was recently released in India on Prime Video after screening at several international film festivals. Richa Chadha and Ali Fazal, at a press event, spoke about financing their maiden production. The Heeramandi actor said, ""We are all from a country that is famous for its jugaad (quick fix); its ability to figure out a way to get things done. Honestly, we asked for money from here and there, and even broke our FDs to fund Girls Will be Girls. But we managed."" ""For instance, this film was edited in France. It received a grant because of the core idea of the film,"" the Masaan actor added. For the unversed, Ali Fazal and Richa Chadha launched their production house with the goal of supporting filmmakers struggling with financial limitations. Girls Will Be Girls marked their debut project, directed by Shuchi Talati. The film premiered at the 2024 Sundance Film Festival, earning two awards and widespread acclaim. Actors Priyanka Chopra, Hrithik Roshan, and Aditi Rao Hydari praised the film after its OTT release. Watch the trailer of Girls Will Be Girls here:    India Today Digital, in its review for Girls Will Be Girls, gave the film four out of five stars. An excerpt from the review read: ""Preeti Panigrahi pulls through the performance of a lifetime as the teen undergoing internal struggle. The 22-year-old is pitch-perfect in her portrayal, which is so natural and spontaneous. Winning the Special Jury Award for Acting at the 2024 Sundance Film Festival is no mean feat, so you can have an idea what a terrific performance hers might be."" It continued, ""Her exchanges with Kani Kasruti, a seasoned and one of the most nuanced actors, makes up for most of the film, but even otherwise, she brilliantly captures every body movement, from the slight flinch or disappointment to fear to excitement, with perfection. The camera hovers over her throughout the film, and she holds your attention, almost commanding it in most sequences."" Girls Will Be Girls explores the challenges of adolescence and societal pressures through the story of 18-year-old Mira. The film follows her journey of rebellion and emotional struggles, intertwined with her mother's own incomplete coming-of-age experiences.Published By: Anindita MukhopadhyayPublished On: Dec 21, 2024ALSO READ |  Richa Chadha-Ali Fazal's 'Girls Will...' wins big at Indian Film Festival Los AngelesMust Watch 
",bollywood,2024-12-21T17:21:00,15.4,6.0
