UUID,Headline,Link,Content,Category,DateTime,Positive,Negative
f303ae39-504d-4557-af9d-e209bca13146,"Varun Dhawan on Salman Khan's cameo in Baby John: Its impact will last for many daysSalman Khan is set to make a cameo appearance in the upcoming film Baby John. Varun Dhawan, who plays the lead in the movie, shared insights about the superstar's role.",https://www.indiatoday.in/movies/bollywood/story/varun-dhawan-on-salman-khan-cameo-in-baby-john-its-impact-will-last-for-many-days-2650209-2024-12-15,"Superstar Salman Khan is set to make a cameo appearance in Varun Dhawan's upcoming film Baby John. During a recent press conference in Delhi, Varun shared insights about Salman’s role in the movie. Directed by Kalees, Baby John is slated for a theatrical release on Christmas 2024. Speaking at the event, Varun Dhawan said, ""No matter how much I say about them, it will always feel less. I think all the viewers, the entire country, loves them a lot, and after a long time, we'll get the chance to see them again. It's a proper five to six minute scene—a big scene with action, drama, and comedy. I believe its impact will last for many days.""  Watch the trailer of Baby John here:    During the same event, Varun also clarified that Baby John is not a direct remake of the original (Theri) but an adaptation with significant changes. He explained, “When Atlee came with this film, there was a reason behind it, and he said that we had to change a lot of the geography of the film. We have to use it as an adaptation and not really a proper remake, and I think that's what's done.” He further said that audiences expecting a frame-by-frame recreation of Theri might be disappointed. “Like you see, a lot of the frames and a lot of the story angles are different. So, if someone comes in expecting a book-by-book remake, they will be disappointed because that's not what the film is. It's an adaptation. We're not running away from that, but it's more of an adaptation,” he said. Directed by Kalees, Baby John is produced by Atlee. The movie features Varun Dhawan in a rugged avatar and also stars Jackie Shroff, Keerthy Suresh, and Wamiqa Gabbi in prominent roles. Special appearances by Salman Khan, Diljit Dosanjh, and Sanya Malhotra add to its appeal.Published By: Anisha RaoPublished On: Dec 15, 2024ALSO READ |  Varun Dhawan's Baby John: What to expect from the remake of Atlee's TheriMust Watch 
",bollywood,2024-12-15T19:32:00,6.4,2.3
39ba8cd6-e33e-4b30-b193-0126bb35d5bd,"Varun Dhawan on Baby John being a Theri remake: We had to change a lotActor Varun Dhawan clarified that his upcoming film, Baby John is an adaptation of the Tamil movie Theri, not a remake. He also said that Baby John has significant changes. ",https://www.indiatoday.in/movies/bollywood/story/varun-dhawan-baby-john-theri-remake-had-to-change-a-lot-2649984-2024-12-15,"At a recent press event, actor Varun Dhawan addressed questions about his upcoming film, Baby John, which is Bollywood's take on the 2016 Tamil film, Theri. The film, directed by Kalees, is set to release on December 25.   Dhawan clarified that Baby John is not a direct remake of the original but an adaptation with significant changes. He explained, “When Atlee came with this film, there was a reason behind it, and he said that we had to change a lot of the geography of the film. We have to use it as an adaptation and not really a proper remake, and I think that's what's done.”   He further said that audiences expecting a frame-by-frame recreation of Theri might be disappointed.  “Like you see, a lot of the frames and a lot of the story angles are different. So, if someone comes in expecting a book-by-book remake, they will be disappointed because that's not what the film is. It's an adaptation. We're not running away from that, but it's more of an adaptation,” he said.   Watch Theri's trailer here:   According to the actor, the film offers a contemporary take on parenting and highlights issues of women’s safety in India. Additionally, it incorporates a storyline inspired by real events. “There’s a case -- a big case -- which is inspired by some real events, and that's in the film as well. The role is also quite changed from that point of view,” he added.   Directed by Kalees, Baby John is produced by Atlee. The movie features Varun Dhawan in a rugged avatar and also stars Jackie Shroff, Keerthy Suresh, and Wamiqa Gabbi in prominent roles. Special appearances by Salman Khan, Diljit Dosanjh, and Sanya Malhotra add to its appeal. Watch Baby John's trailer here:   Baby John is set to release on December 25 and promises high-octane action, along with a compelling narrative.Published By: Trisha BhattacharyaPublished On: Dec 15, 2024READ MORE |  Shah Rukh Khan praises Baby John trailer, Varun hopes to make 'bade bhaiya' proudMust Watch 
",bollywood,2024-12-15T10:21:00,10.7,2.0
068b8af4-fc5e-4eb0-b5fd-4dd17b609dfa,"KJo on 23 years of Kabhi Khushi Kabhie Gham: One of those pinch me moments…Karan Johar celebrated 23 years of the iconic movie Kabhi Khushi Kabhie Gham. On Saturday, the filmmaker shared stills from the film with a heartfelt note on Instagram. ",https://www.indiatoday.in/movies/bollywood/story/karan-johar-on-23-years-of-shah-rukh-khan-amitabh-bachchan-kabhi-khushi-kabhie-gham-2649801-2024-12-14,"Filmmaker Karan Johar celebrated 23 years of Kabhi Khushi Kabhie Gham by sharing stills from the iconic film. KJo expressed heartfelt gratitude to the fans, cast, and crew of K3G and fondly reminisced about working on set with ""legends."" Released in 2001, the film marked Karan's second directorial venture after Kuch Kuch Hota Hai. Karan's note read, ""23 years!!! Phew. Truly one of those pinch me moments - right now & even back then. Being on set with these legends!! It was my second film as a director and I think I was immensely fortunate that this magnanimous cast and the entire crew put in so much faith in me to deliver Khushi & Gham in abundance (sic)."" He added, ""The biggest shout out goes to the audience, the fans, our family - who continue to watch our film and recite every dialogue, dance on every song and keep this film alive in its truest sense. THANK YOU (sic).""  Here's the post: 



 

 
 


 


View this post on Instagram

 


 
 
 


 
 


 
 
 



 
 

A post shared by Karan Johar (@karanjohar)


 A post shared by Karan Johar (@karanjohar)
 Several actors and celebrities reacted to Karan's post. Check out a few of the comments here: 
 


 Kabhi Khushi Kabhie Gham, directed by Karan Johar, is a timeless Bollywood classic about love, family, and relationships. Featuring an ensemble cast of Amitabh Bachchan, Jaya Bachchan, Shah Rukh Khan, Kajol, Hrithik Roshan, and Kareena Kapoor, the film beautifully explores emotional bonds, generational conflicts, and the enduring strength of family ties.Published By: Anisha RaoPublished On: Dec 14, 2024ALSO READ |  Someone edited this 'K3G' scene with 'Saari Duniya Jalaa...'. You'll watch it on loopMust Watch 
",bollywood,2024-12-14T14:29:00,17.2,0.7
6355b289-2ab9-4219-8f70-0fc3391ebcd4,Rani Mukerji's Mardaani 3 to release in theatres in 2026The makers of the upcoming film Mardaani 3 announced that the film will release in theatres in 2026. Actor Rani Mukerji will reprise her role as Shivani Shivaji Rao. ,https://www.indiatoday.in/movies/bollywood/story/rani-mukerji-mardaani-3-to-release-in-2026-2649254-2024-12-13,"YRF announced that Rani Mukerji's highly anticipated Mardaani 3 will release in theatres in 2026. The announcement was made on the release anniversary of Mardaani 2, with a poster shared on social media. The film will go on floors in April 2025.  Alongside the poster, the makers wrote, ""The wait is over! #RaniMukerji is back as the fierce Shivani Shivaji Roy in #Mardaani3. In cinemas 2026 (sic)."" The cop thriller, which stars Rani as the protagonist, has previously seen two successful installments.  Check out the post here:



 

 
 


 


View this post on Instagram

 


 
 
 


 
 


 
 
 



 
 

A post shared by Yash Raj Films (@yrf)


 A post shared by Yash Raj Films (@yrf)
 Talking about the film, Rani, who will play Shivani Shivaji Roy, said, “I’m thrilled to announce that we are starting shooting Mardaani 3 in April 2025! It is always special to wear the police uniform and play a character that has only given me love. I’m proud to essay the character of this feisty cop again in Mardaani 3 as a tribute to all the unsung, brave, self-sacrificing cops who work tirelessly every single day to keep us safe.” She continued, ""When we set out to make Mardaani 3, we were hoping that we could find a script that would take the experience of watching a Mardaani franchise film higher. I am really excited about what we have at hand, and I’m only hoping that the audience too feels the same after watching Mardaani 3 in theatres."" The actor added, ""Mardaani is an extremely loved franchise, and we have a certain responsibility to deliver to the expectations that people have. We will do our best to live up to this. Mardaani 3 is dark, deadly and brutal. So, I’m intrigued to find out the response of the people towards our film. I hope they shower this film with the same amount of love that they have always given."" 'Mardaani' Part 1 released in 2014. The film expanded with a sequel in 2019. Both of these films were massive hits at the box office.Published By: Anisha RaoPublished On: Dec 13, 2024ALSO READ |  Mardaani 2 Movie Review: Rani Mukerji gets the perfect nemesis in Vishal JethwaMust Watch 
   'Mardaani' Part 1 released in 2014. The film expanded with a sequel in 2019. Both of these films were massive hits at the box office.Published By: Anisha RaoPublished On: Dec 13, 2024ALSO READ |  Mardaani 2 Movie Review: Rani Mukerji gets the perfect nemesis in Vishal JethwaMust Watch 
",bollywood,2024-12-13T12:21:00,14.6,0.8
235d66ee-56ed-474b-a9c9-82a4706103cc,"SRK shares sweet birthday wish for 'coolest and bossest' RajinikanthSuperstar Shah Rukh Khan on Thursday shared the sweetest birthday wish for megastar Rajinikanth. Sharing a photo of himself with the icon, SRK called Rajinikanth 'remarkably simple' and 'inspiring.'",https://www.indiatoday.in/movies/bollywood/story/shah-rukh-khan-shares-sweet-birthday-wish-for-coolest-and-bossest-rajinikanth-2649125-2024-12-13,"Superstar Shah Rukh Khan on Thursday shared a heartfelt birthday wish for Rajinikanth. Sharing a photo of the two of them on his social media handle, SRK addressed Rajinikanth as the 'coolest.' ""To the coolest of the cool. The bossest of all the bosses. The man, the legend and an absolutely remarkably simple man, despite being the Superest of Stars!! Sir, thank u for inspiring us. Be healthy and know u are respected and loved too much. Have a great birthday @rajinikanth sir (sic),"" wrote Shah Rukh Khan on Instagram.  See SRK's post for the actor here:



 

 
 


 


View this post on Instagram

 


 
 
 


 
 


 
 
 



 
 

A post shared by Shah Rukh Khan (@iamsrk)


 A post shared by Shah Rukh Khan (@iamsrk)
 Fans were quick to react as one of them wrote in the comment box, ""SRK’s love for Rajinikanth."" Another user mentioned, ""Two legends in one frame,"" while many others posted fire and heart emojis.  On the work front, while Rajinikanth is awaiting the release of Lokesh Kanagaraj's highly-anticipated Coolie, Shah Rukh Khan recently announced the Sujoy Ghosh film, King, where he will be seen sharing screen space with his daughter and actor Suhana Khan for the first time. Published By: Anvita SinghPublished On: Dec 13, 2024ALSO READ |  Priyanka Chopra on working in SRK's Don: I tasted blood a little bitTrending Reel 
",bollywood,2024-12-13T00:07:00,22.3,0.8
7a6b5bc7-1ac9-4082-9abd-f89c4ca4715f,"Akshay Kumar injures his eye on Housefull 5 set: ReportBollywood star Akshay Kumar reportedly suffered from an eye injury while shooting for the comedy, Housefull 5. The incident took place while the actor was filming a stunt sequence. ",https://www.indiatoday.in/movies/bollywood/story/akshay-kumar-injures-his-eye-on-housefull-5-set-2649059-2024-12-12,"Actor Akshay Kumar, who is presently filming Housefull 5 in Mumbai, encountered an accident while performing a stunt for the movie. It has been reported that the actor sustained an eye injury during the incident. According to Hindustan Times, an object struck Akshay's eye while he was engaged in a stunt. An ophthalmologist was immediately summoned to the set, who treated the eye with a bandage and advised him to rest. Despite the injury, the shoot continued with the other actors. Akshay, however, is determined to return to the set soon as the film is nearing completion, and he wishes to avoid any delays. Housefull 5 boasts an ensemble cast, including series regulars Akshay Kumar and Riteish Deshmukh, along with the return of Abhishek Bachchan, Shreyas Talpade, Chunky Panday, and Nargis Fakhri. New additions to the cast feature Fardeen Khan, Dino Morea, Johnny Lever, Jackie Shroff, Sanjay Dutt, Nana Patekar, Sonam Bajwa, Chitrangda Singh, and Soundarya Sharma. The film commenced production earlier this year in Europe, with the cast spending 40 days filming on a cruise ship that sailed from Newcastle to Spain, Normandy, Honfleur, and back to Plymouth. Directed by Tarun Mansukhani, Housefull 5 is slated for a release on June 6, 2025.Published By: Anvita SinghPublished On: Dec 12, 2024ALSO READ |  No Hera Pheri: Suniel Shetty, Paresh Rawal, Akshay Kumar reunite for Kudo eventTrending Reel 
",bollywood,2024-12-12T22:14:00,4.1,7.3
6b67f197-8203-48fb-bc5f-621473e06508,"Preity Zinta's sweet BTS moment from Dil Chahta Hai: A chocolate croissant to rescuePreity Zinta shared a heartwarming behind-the-scenes story from the shoot of Dil Chahta Hai, highlighting a moment of hunger and humour that ended with a chocolate croissant. ",https://www.indiatoday.in/movies/bollywood/story/preity-zinta-sweet-bts-moment-from-dil-chahta-hai-a-chocolate-croissant-to-rescue-2649030-2024-12-12,"Preity Zinta recently shared a behind-the-scenes (BTS) moment from her film Dil Chahta Hai, offering a nostalgic glimpse into the making of one of Bollywood's most loved movies. The picture, which features Zinta on set, was taken during the shoot of the song Jane Kyu Log in Sydney. In her Instagram post, Preity fondly recalled the moment when the photo was captured. She shared that, like most shoots, they were working under a tight schedule and had to wrap up quickly. “We were shooting the song 'Jaane Kyu Log Pyar Karte Hai' in Sydney,” she wrote, “and like all shoots, we had to hurry & finish within a certain time frame, so everyone was focused on finishing the shoot as soon as possible.” However, the actress humorously revealed that she had missed breakfast that morning and, unsurprisingly, all she could think about was food. “I was starving,"" she admitted. ""Once the shoot was over, I was asked to do a few stills/photos. I made a face and said I’m starving. Can we do this later?” Preity added, sharing her relatable hunger-driven frustration.



 

 
 


 


View this post on Instagram

 


 
 
 


 
 


 
 
 



 
 

A post shared by Preity G Zinta (@realpz)


 A post shared by Preity G Zinta (@realpz)
 As she was about to do the photoshoot, someone on set suggested a fun way to get her in the mood for the shot. “Someone said, 'It will only take a second. Just look at the camera and think of a yummy chocolate croissant...' And that’s exactly what I did when this photo was taken,” Preity recalled. The candid moment has stayed with her, and she expressed how the photo always serves as a reminder to enjoy and appreciate the little things in life that bring joy. ""This photo always reminds me of enjoying & appreciating the little things that bring us so much joy,"" she reflected. Preity concluded her post with a warm invitation to her followers to share what brings them joy. ""Tell me what makes you smile like that? I’d love to know,"" she wrote, sparking a conversation with her fans about the small pleasures that light up their lives. The post not only gives fans a rare insight into the making of Dil Chahta Hai. From memorable moments on set to the joy of indulging in a simple chocolate croissant, Zinta’s reflection serves as a reminder to cherish life’s little pleasures.Published By: shweta keshriPublished On: Dec 12, 2024Must Watch 
",bollywood,2024-12-12T21:12:00,18.9,4.3
aef00406-6fd1-449f-b0aa-0059fd09ade9,Anees Bazmee recalls being Raj Kapoor's assistant director: He breathed cinemaDirector Anees Bazmee opens up about being iconic filmmaker Raj Kapoor's former assistant director. Bazmee had assisted Kapoor on Prem Rog. ,https://www.indiatoday.in/movies/bollywood/story/anees-bazmee-recalls-being-raj-kapoor-assistant-director-2648884-2024-12-12,"Not many know that blockbuster director Anees Bazmee started his career as Raj Kapoor's assistant director. As the world celebrates the legendary filmmaker's centenary, Bazmee exclusively spoke to India Today Digital about his learning and time with the maverick and whether he incorporates those in his own films. The Bhool Bhulaiyaa 3 director shared that he met Raj Kapoor through a senior writer. As he was starting work on Prem Rog, Kapoor let him join the team, and that's how the journey began. Talking about what he observed and learnt being around Raj Kapoor, Bazmee said, ""His passion. It was something else. He slept, ate, and walked cinemas. He actually breathed and lived cinema. He could only make these great films because of his love towards the craft. He had such a big vision, and he knew how to translate that on screen through camera."" When asked if he managed to use all these learnings to make films like him, the Welcome director sheepishly said, ""Not at all, because I could never do that. He was a genius and no one could ever match up to his skills. But I truly feel that whatever little I have achieved, it's all because I started with him. I have often wondered if he was around when I made films. I would have been in seventh heaven then. I remember when I was writing, and then directing my first film, I often lamented that he could never see his student walking on the same path."" Bazmee also shared that Raj Kapoor was very particular about his assistants being treated the same way, ""We also got to travel in planes with him, stay in big hotels, and have the same food. He was a professional and a team leader that we should all aspire to be."" The Singh is Kinng maker also said that Raj Kapoor gave most actors their best performances. He also made the supporting cast shine with strong written parts, ""He was a visionary. Even the extras in the films come across as an important part. That was the RK magic."" Discussing more about the mood on an RK film set, Bazmee said that the celebrated filmmaker would be in the best of the mood, showering love on everyone if things were going as per plan on his set. And when it didn't, everyone would be at the receiving end of his scolding. ""But those were also out of love, because he wanted the best out of the actors and the film. Personally, I remember standing with my hands folded behind me. He was a big man for me to even have an equation with. But just being in the same room was a learning experience."" As readers would know, to celebrate his 100th birth anniversary, an RK Film Festival has been planned across 40 cities, from December 13-15. Anees Bazmee picked Prem Rog as the film he would want to watch again on the big screens. He also shared that it's a great opportunity to take the iconic films to the younger generation, ""I am so glad that Raj sahab's legacy continues through his grandchildren now. I think Ranbir Kapoor, Kareena Kapoor and even Karisma Kapoor are such amazing actors. Even Chintu ji (Rishi Kapoor) contributed so much to the Kapoor name."" Anees Bazmee also remembered the famous RK Studios, sharing that most films were shot there. He added that they would spend their entire day there, and that he has beautiful memories of the place. ""All his sets were so grand, almost like it came from another world. Raj saab ka kamaal hi kuch aur tha (He really did wonders),"" the proud student concluded.Published By: Anvita SinghPublished On: Dec 12, 2024ALSO READ |  Kareena-Saif, Ranbir Kapoor in Delhi to mark Raj Kapoor's 100th birth anniversary
",bollywood,2024-12-12T17:16:00,17.8,0.6
c2af656f-3e8c-408a-b24b-4a4a457136b8,"Go this weekend: All We Imagine as Light back in cinemas, Payal Kapadia thrilledDirector Payal Kapadia's film, All We Imagine As Light, has returned to cinemas with improved showtimes in select cities.",https://www.indiatoday.in/movies/bollywood/story/all-we-imagine-as-light-back-in-cinemas-director-payal-kapadia-thrilled-2648880-2024-12-12,"Director Payal Kapadia’s acclaimed film All We Imagine As Light is now back in cinemas once again. The Cannes award-winning film is set to receive better showtimes in select cities such as Delhi, Mumbai, Bhubaneshwar, two weeks after its initial release in India on November 22. The announcement comes after numerous fans expressed their desire for better screening slots, tagging Kapadia on social media and requesting wider access to the film. Kapadia shared the news on X with the caption, ""And back in Delhi with great timings ! Pls tag Delhi folks... I don’t know how long it will last so go go go this weekend which you still can (sic).""

And back in Delhi with great timings !
Pls tag Delhi folks... I don’t know how long it will last so go go go this weekend which you still can pic.twitter.com/nX2poBgsYN
— Payal Kapadia (@PayalKapadia86) December 12, 2024
 And back in Delhi with great timings !
Pls tag Delhi folks... I don’t know how long it will last so go go go this weekend which you still can pic.twitter.com/nX2poBgsYN
— Payal Kapadia (@PayalKapadia86) December 12, 2024 Payal Kapadia’s All We Imagine As Light has announced updated showtimes in select cities. In Delhi, the film will screen at 5:20 pm, 3:25 pm, and 4:25 pm. Mumbai showtimes include 1:45 pm, 7:50 pm, and 3:45 pm. Additionally, there is a screening in Bhubaneshwar at 3:15 pm. These changes come as part of the film's re-release, aiming to provide better accessibility to audiences. Recently, the film bagged two nominations in Golden Globe Awards 2025, including Best Director (Motion Picture) and Best Non-English Language Motion Picture.



 

 
 


 


View this post on Instagram

 


 
 
 


 
 


 
 
 



 
 

A post shared by All We Imagine as Light (@allweimagineaslightfilm)


 A post shared by All We Imagine as Light (@allweimagineaslightfilm)
 The film became the first Indian film to win the prestigious Grand Prix at Cannes 2024. It has also received the Jury Grand Prize at the Asia Pacific Screen Awards, Best International Feature at Gotham Awards, and Best International Film Award at the New York Film Critics Circle, among several others.Published By: Trisha BhattacharyaPublished On: Dec 12, 2024READ MORE |  Payal Kapadia reacts to jurors claiming All We Imagine... 'wasn't Indian enough'
",bollywood,2024-12-12T17:30:00,17.8,0.5
68ff93ae-7ba5-409f-a0d1-af64ac51e99c,"Priyanka Chopra on working in SRK's Don: I tasted blood a little bitGlobal icon Priyanka Chopra recently opened up about working in the Farhan Akhtar directorial, Don, which also starred superstar Shah Rukh Khan in the lead. ",https://www.indiatoday.in/movies/bollywood/story/priyanka-chopra-on-working-in-shah-rukh-khan-don-2648797-2024-12-12,"Global icon Priyanka Chopra recently turned heads at the Red Sea Film Festival. At the event, while discussing her career, Priyanka also opened up about doing action on screen while working on the Shah Rukh Khan-starrer Don. The actor said she ""tasted blood a little bit"" while doing the Farhan Akhtar directorial.  “I took Tai Chi classes and worked really hard to perfect it because I wanted to do it right. By the time I came to Don, I had realised that the most important thing to focus on is my craft, not your relationships with your director, co-actors, not how you behave on set, but what you do between action and cut,” said the actor. 



 

 
 


 


View this post on Instagram

 


 
 
 


 
 


 
 
 



 
 

A post shared by Patty Cardona (@jerryxmimi)


 A post shared by Patty Cardona (@jerryxmimi)
 Stating that people enjoyed watching her in the film, Priyanka said, ""A lot of training went into the action sequences in Don, and I tasted blood a little bit. I look really good with a weapon in my hand defending my country; what can I say?” Priyanka Chopra essayed the role of Roma in Don. The original, written by Salim-Javed, starred Amitabh Bachchan in the lead role. Filmmaker Farhan Akhtar remade Don in 2006 with SRK in the lead.  The director recently announced Don 3, which will see Ranveer Singh in the titular role. The movie will also star Kiara Advani in a pivotal role. Published By: Anvita SinghPublished On: Dec 12, 2024ALSO READ |  Priyanka Chopra shares 'magic' moments with daughter Malti and Nick JonasMust Watch 
",bollywood,2024-12-12T14:51:00,9.6,2.1
