UUID,Headline,Link,Content,Category,DateTime,Positive,Negative
5670f2c4-9aae-44dc-a66e-7d6455c87243,"Yeh Jawaani Hai Deewani to re-release? Dharma's cryptic post sparks speculationDharma Movies shared a cryptic post on Monday suggesting the re-release of the hit film Yeh Jawaani Hai Deewani. The film stars Ranbir Kapoor, Deepika Padukone, Kalki Koechlin, Aditya Roy Kapur and others. ",https://www.indiatoday.in/movies/bollywood/story/yeh-jawaani-hai-deewani-to-re-release-in-theatres-dharma-production-shares-cryptic-post-2654007-2024-12-23,"A post on Dharma Movies' official Instagram account sparked speculation among fans of the hit Bollywood film Yeh Jawaani Hai Deewani, suggesting a possible theatrical re-release of the romantic comedy.  Sharing a scene from the 2013 film on Instagram, Dharma Movies captioned the post, ""Humein inse pyaar ho jaayega...phir se! #StayTuned (sic).""  Here's the post: 



 

 
 


 


View this post on Instagram

 


 
 
 


 
 


 
 
 



 
 

A post shared by Dharma Productions (@dharmamovies)


 A post shared by Dharma Productions (@dharmamovies)
 Fans couldn't contain their excitement and flooded the comment section with anticipatory comments. Users wondered if there would be a sequel to Yeh Jawani Hai Deewani. A section of Instagram users also expressed their happiness at the re-release of the film.  Here are the comments:
 


 Yeh Jawaani Hai Deewani (2013), directed by Ayan Mukerji, is a coming-of-age romantic drama that struck a chord with audiences, especially the youth, for its relatable themes of love, friendship, and self-discovery. Starring Ranbir Kapoor and Deepika Padukone in lead roles, alongside Kalki Koechlin and Aditya Roy Kapur, the film beautifully balanced heartfelt emotions and vibrant energy. Critics praised its performances, music, and visually stunning cinematography, although some pointed out its conventional storyline. The film was a massive box-office success, earning over Rs 300 crore globally, becoming one of the highest-grossing Bollywood films of its time. Its soulful songs and inspiring dialogues ensured its enduring appeal among fans.Published By: Anisha RaoPublished On: Dec 23, 2024ALSO READ |  YJHD reunion ft Deepika-Ranbir to Al Pacino becoming a dad at 82. On Feel-Good FridayMust Watch 
",bollywood,2024-12-23T13:36:00,16.1,2.0
cbd44945-5e72-46f5-a82d-5cb1cc8db5f8,"When Diljit Dosanjh was cast as Priyanka Chopra's on-screen husbandFilmmaker Boney Kapoor recently revealed that he wanted to cast Diljit Dosanjh alongside Priyanka Chopra in a movie. In an interview, he said that he wanted the singer to play Chopra's husband in the film. 
",https://www.indiatoday.in/movies/bollywood/story/boney-kapoor-shared-that-diljit-dosanjh-was-cast-to-play-priyanka-chopra-on-screen-husband-2654024-2024-12-23,"Filmmaker Boney Kapoor recently revealed that Diljit Dosanjh was to be cast alongside Priyanka Chopra for a film. Speaking about it in an interview, Boney also said that the singer was to play the actor's husband and that he waited for Chopra for nearly two years. Speaking to Zoom, Boney Kapoor highlighted Diljit's achievements and expressed his pride in him. He said, ""I’m very proud of what he has achieved and what he’s achieving. He is risen. In fact, I wanted to cast him in a film which we had planned about six or seven years before Priyanka (Chopra) migrated to the US, before Quantico. In fact, she had loved the subject that we were planning."" Boney added, ""For one to two years, we waited for her. When I used to speak to her, she said, I have the script next to me, and every night I think of this and imagine myself. In that particular film, we wanted Diljit opposite her, and we had met Diljit, and we had told him that you'd be opposite her in the film, playing her husband."" ""So our relationship is that old. And today again, there’s a God-given opportunity that he (Diljit) will be part of No Entry Part 2"", he concluded. Meanwhile, it has been reported that No Entry 2 will feature Diljit Dosanjh and Varun Dhawan together. Further details about the film's cast and crew will be shared soon.Published By: Anisha RaoPublished On: Dec 23, 2024ALSO READ |  Fardeen Khan talks about 'No Entry 2': 'All I would say is, don't mess it up'Must Watch 
",bollywood,2024-12-23T14:13:00,7.3,2.0
8e84250e-3914-4f43-8e3b-376f61f4491d,"Orry joins Bhansali's Love and War cast, Deepika Padukone to make cameo Sanjay Leela Bhansali's Love and War will star Orry, alongside Ranbir Kapoor, Alia Bhatt, and Vicky Kaushal. Deepika Padukone will make a cameo. The film releases in March 2026.",https://www.indiatoday.in/movies/bollywood/story/orry-sanjay-leela-bhansali-love-and-war-deepika-padukone-cameo-2654018-2024-12-23,"The cast of Sanjay Leela Bhansali's highly anticipated film, Love and War, just got more exciting. We have exclusively learnt that social media sensation Orry, originally named Orhan Awatramani, has joined the cast of the film, which is led by actors Ranbir Kapoor, Alia Bhatt, and Vicky Kaushal. Deepika Padukone has also been roped in to play a cameo. According to a source close to the film, in Love and War, Orry will be seen portraying a homosexual character who is Alia’s closest friend. While Alia takes on the role of a cabaret dancer, Ranbir and Vicky will play officers in the Indian Armed Forces. Not much has been revealed about Deepika Padukone's character yet.  Deepika has earlier collaborated with Bhansali on acclaimed films like Goliyon Ki Raasleela, Ram-Leela, Bajirao Mastani, and Padmaavat.  The epic saga, set to be a grand cinematic spectacle, is scheduled to hit theatres on March 20, 2026.Published By: Arushi JainPublished On: Dec 23, 2024ALSO READ |  Sanjay Leela Bhansali's Love and War, a remake of Sangam? Filmmaker clarifies
",bollywood,2024-12-23T13:58:00,15.7,7.6
